{
  "$schema": "https://json-schema.org/draft/2020-12/schema",
  "$id": "https://github.com/TheAgentEconomy/awesome-agent-services/service-schema.json",
  "title": "Agent Service",
  "type": "object",
  "additionalProperties": false,
  "required": [
    "name",
    "slug",
    "category",
    "type",
    "description",
    "url",
    "tags",
    "agent_interfaces"
  ],
  "properties": {
    "name": {
      "type": "string",
      "minLength": 2
    },
    "slug": {
      "type": "string",
      "pattern": "^[a-z0-9]+(?:-[a-z0-9]+)*$"
    },
    "category": {
      "type": "string",
      "enum": [
        "x402 Services",
        "MCP Servers",
        "Agent APIs",
        "Data Feeds",
        "Business Intelligence",
        "Finance & Signals",
        "Travel",
        "Image & Media",
        "Commerce & Payments",
        "Developer Tools"
      ]
    },
    "type": {
      "type": "string",
      "enum": [
        "service",
        "api",
        "mcp-server",
        "protocol",
        "directory",
        "infrastructure"
      ]
    },
    "description": {
      "type": "string",
      "minLength": 20,
      "maxLength": 400
    },
    "url": {
      "type": "string",
      "format": "uri"
    },
    "repository": {
      "type": "string",
      "format": "uri"
    },
    "documentation": {
      "type": "string",
      "format": "uri"
    },
    "npm": {
      "type": "string",
      "format": "uri"
    },
    "x402": {
      "type": "object",
      "additionalProperties": false,
      "properties": {
        "enabled": {
          "type": "boolean"
        },
        "discovery_url": {
          "type": "string",
          "format": "uri"
        },
        "network": {
          "type": "string"
        },
        "settlement_asset": {
          "type": "string"
        }
      }
    },
    "mcp": {
      "type": "object",
      "additionalProperties": false,
      "properties": {
        "server_name": {
          "type": "string"
        },
        "transport": {
          "type": "array",
          "items": {
            "type": "string",
            "enum": [
              "stdio",
              "http",
              "sse",
              "streamable-http"
            ]
          },
          "uniqueItems": true
        },
        "install": {
          "type": "string"
        },
        "glama_url": {
          "type": "string",
          "format": "uri"
        }
      }
    },
    "agent_interfaces": {
      "type": "array",
      "items": {
        "type": "string",
        "enum": [
          "mcp",
          "http-api",
          "x402",
          "sdk",
          "web",
          "cli"
        ]
      },
      "minItems": 1,
      "uniqueItems": true
    },
    "tags": {
      "type": "array",
      "items": {
        "type": "string"
      },
      "minItems": 1,
      "uniqueItems": true
    },
    "status": {
      "type": "string",
      "enum": [
        "active",
        "experimental",
        "unknown"
      ],
      "default": "unknown"
    },
    "submitted_by": {
      "type": "string"
    }
  }
}
