{
  "name": "CoinOpAI MCP",
  "slug": "coinopai-mcp",
  "category": "MCP Servers",
  "type": "mcp-server",
  "description": "Local stdio MCP server for x402-powered paid crypto intelligence, trade decisions, audits, risk state, signal history, and agent automation search.",
  "url": "https://github.com/forgemeshlabs/coinopai-mcp",
  "repository": "https://github.com/forgemeshlabs/coinopai-mcp",
  "mcp": {
    "server_name": "coinopai-mcp",
    "transport": [
      "stdio"
    ],
    "glama_url": "https://glama.ai/mcp/servers/forgemeshlabs/coinopai-mcp"
  },
  "agent_interfaces": [
    "mcp",
    "x402"
  ],
  "tags": [
    "crypto",
    "signals",
    "mcp",
    "x402"
  ],
  "status": "active",
  "submitted_by": "The Agent Economy"
}
