{
  "name": "Travel Assistant MCP",
  "slug": "travel-assistant-mcp",
  "category": "Travel",
  "type": "mcp-server",
  "description": "Public MCP server for travel search workflows, airport lookup, route comparison, travel timing guidance, and external booking links.",
  "url": "https://github.com/forgemeshlabs/travel-mcp",
  "repository": "https://github.com/forgemeshlabs/travel-mcp",
  "npm": "https://www.npmjs.com/package/@forgemeshlabs/travel-assistant-mcp",
  "mcp": {
    "server_name": "travel-assistant-mcp",
    "transport": [
      "stdio"
    ],
    "install": "npx -y @forgemeshlabs/travel-assistant-mcp",
    "glama_url": "https://glama.ai/mcp/servers/forgemeshlabs/travel-mcp"
  },
  "agent_interfaces": [
    "mcp"
  ],
  "tags": [
    "travel",
    "airports",
    "route-comparison",
    "booking-links"
  ],
  "status": "active",
  "submitted_by": "The Agent Economy"
}
